Group;Section;QPos;Question;Type;Options;Role;TriggerReportOn;Surveillance;Actions
Hypotension orthostatique;Hypotension orthostatique;1;À revoir;radio;Oui|Non;lock;Oui;À revoir;
Hypotension orthostatique;Hypotension orthostatique;2;Test d’hypotension orthostatique positif ou forte suspicion clinique;radio;Oui:50|Non:0;;Oui;;"Règles hygiéno diététique de l’HTO|Traitement symptomatique : Manœuvre de secours|Réévaluation et traitement des :|-Causes médicamenteuse : Adaptation du traitement|-Causes d’hypovolémie : hydratation|-Causes de dysautonomie : control de la pathologie|Envisager le traitement médicamenteux : en cas d’échec des autres traitements dans les HTO neurogène. Prendre en compte les effets secondaires : Agoniste Alpha Adrénergique (Gutron…)"
Hypotension orthostatique;Hypotension orthostatique;3;La fréquence cardiaque augmente : >10/min;radio;;;Oui;Argument en faveur d’une hypovolémie;"Règles hygiéno diététique de l’HTO|Traitement symptomatique : Manœuvre de secours|Réévaluation et traitement des :|-Causes médicamenteuse : Adaptation du traitement|-Causes d’hypovolémie : hydratation|-Causes de dysautonomie : control de la pathologie|Envisager le traitement médicamenteux : en cas d’échec des autres traitements dans les HTO neurogène. Prendre en compte les effets secondaires : Agoniste Alpha Adrénergique (Gutron…)|L'augmentation de la fréquence cardiaque faire rechercher et traiter une cause d'hypovolémie"
Hypotension orthostatique;Hypotension orthostatique;4;La fréquence cardiaque reste stable;radio;;;Oui;Argument en faveur d’une dysautonomie;"Règles hygiéno diététique de l’HTO|Traitement symptomatique : Manœuvre de secours|Réévaluation et traitement des :|-Causes médicamenteuse : Adaptation du traitement|-Causes d’hypovolémie : hydratation|-Causes de dysautonomie : control de la pathologie|Envisager le traitement médicamenteux : en cas d’échec des autres traitements dans les HTO neurogène. Prendre en compte les effets secondaires : Agoniste Alpha Adrénergique (Gutron…)|La stabilité de la fréquence cardiaque faire rechercher et traiter une cause dysautonomie"
Hypotension orthostatique;Hypotension orthostatique;5;Retentissement important;radio;Oui:100|Non:0;;;;
Hypotension orthostatique;Hypotension orthostatique;6;Qualité de la prise en charge actuelle;radio;Bonne|Partielle|Insuffisante;color;;;
